2024-07-06 16:44:20.201831 IP 192.168.1.2.37842 > 192.168.1.50.445: Flags [P.], seq 2858558340:2858558548, ack 3731165957, win 501, options [nop,nop,TS val 3007108209 ecr 955575402], length 208
2024-07-06 16:44:20.204518 IP 192.168.1.50.445 > 192.168.1.2.37842: Flags [P.], seq 1:157, ack 208, win 13203, options [nop,nop,TS val 955576402 ecr 3007108209], length 156
2024-07-06 16:44:20.204548 IP 192.168.1.2.37842 > 192.168.1.50.445: Flags [.], ack 157, win 501, options [nop,nop,TS val 3007108211 ecr 955576402], length 0
2024-07-06 16:44:20.204701 IP 192.168.1.2.37842 > 192.168.1.50.445: Flags [P.], seq 208:317, ack 157, win 501, options [nop,nop,TS val 3007108212 ecr 955576402], length 109
2024-07-06 16:44:20.205356 IP 192.168.1.50.445 > 192.168.1.2.37842: Flags [P.], seq 157:417, ack 317, win 13203, options [nop,nop,TS val 955576403 ecr 3007108212], length 260
2024-07-06 16:44:20.205446 IP 192.168.1.2.37842 > 192.168.1.50.445: Flags [P.], seq 317:409, ack 417, win 501, options [nop,nop,TS val 3007108212 ecr 955576403], length 92
2024-07-06 16:44:20.206122 IP 192.168.1.50.445 > 192.168.1.2.37842: Flags [P.], seq 417:545, ack 409, win 13203, options [nop,nop,TS val 955576403 ecr 3007108212], length 128
2024-07-06 16:44:20.249695 IP 192.168.1.2.37842 > 192.168.1.50.445: Flags [.], ack 545, win 501, options [nop,nop,TS val 3007108257 ecr 955576403], length 0
2024-07-06 16:44:20.977819 IP 192.168.1.2.47584 > 213.123.255.78.80: Flags [.], ack 2438938194, win 501, options [nop,nop,TS val 3833776115 ecr 1099924324], length 0
2024-07-06 16:44:20.985242 IP 213.123.255.78.80 > 192.168.1.2.47584: Flags [.], ack 1, win 503, options [nop,nop,TS val 1099934569 ecr 3833745665], length 0
2024-07-06 16:44:21.198709 IP 192.168.1.2.37842 > 192.168.1.50.445: Flags [P.], seq 409:617, ack 545, win 501, options [nop,nop,TS val 3007109206 ecr 955576403], length 208
2024-07-06 16:44:21.200023 IP 192.168.1.50.445 > 192.168.1.2.37842: Flags [P.], seq 545:701, ack 617, win 13203, options [nop,nop,TS val 955577398 ecr 3007109206], length 156
2024-07-06 16:44:21.200062 IP 192.168.1.2.37842 > 192.168.1.50.445: Flags [.], ack 701, win 501, options [nop,nop,TS val 3007109207 ecr 955577398], length 0
2024-07-06 16:44:21.200394 IP 192.168.1.2.37842 > 192.168.1.50.445: Flags [P.], seq 617:726, ack 701, win 501, options [nop,nop,TS val 3007109207 ecr 955577398], length 109
2024-07-06 16:44:21.201413 IP 192.168.1.50.445 > 192.168.1.2.37842: Flags [P.], seq 701:963, ack 726, win 13203, options [nop,nop,TS val 955577399 ecr 3007109207], length 262
2024-07-06 16:44:21.201636 IP 192.168.1.2.37842 > 192.168.1.50.445: Flags [P.], seq 726:818, ack 963, win 501, options [nop,nop,TS val 3007109208 ecr 955577399], length 92
2024-07-06 16:44:21.202543 IP 192.168.1.50.445 > 192.168.1.2.37842: Flags [P.], seq 963:1091, ack 818, win 13203, options [nop,nop,TS val 955577400 ecr 3007109208], length 128
2024-07-06 16:44:21.233690 IP 192.168.1.2.47600 > 213.123.255.78.80: Flags [.], ack 4078813633, win 501, options [nop,nop,TS val 3833776371 ecr 1099924580], length 0
2024-07-06 16:44:21.241147 IP 213.123.255.78.80 > 192.168.1.2.47600: Flags [.], ack 1, win 506, options [nop,nop,TS val 1099934825 ecr 3833745655], length 0
2024-07-06 16:44:21.245812 IP 192.168.1.2.37842 > 192.168.1.50.445: Flags [.], ack 1091, win 501, options [nop,nop,TS val 3007109253 ecr 955577400], length 0
2024-07-06 16:44:22.354203 IP 192.168.1.2.60353 > 192.168.1.1.53: 5234+ A? fonts.gstatic.com. (35)
2024-07-06 16:44:22.354252 IP 192.168.1.2.60353 > 192.168.1.1.53: 41073+ AAAA? fonts.gstatic.com. (35)
2024-07-06 16:44:22.354746 IP 192.168.1.2.50495 > 192.168.1.1.53: 9424+ A? www.gstatic.com. (33)
2024-07-06 16:44:22.354759 IP 192.168.1.2.50495 > 192.168.1.1.53: 21967+ AAAA? www.gstatic.com. (33)
2024-07-06 16:44:22.354818 IP 192.168.1.1.53 > 192.168.1.2.60353: 5234 1/0/0 A 142.250.200.3 (51)
2024-07-06 16:44:22.354925 IP 192.168.1.1.53 > 192.168.1.2.60353: 41073 1/0/0 AAAA 2a00:1450:4009:81f::2003 (63)
2024-07-06 16:44:22.355121 IP 192.168.1.2.59856 > 142.250.200.3.443: Flags [S], seq 2193324289, win 64240, options [mss 1460,sackOK,TS val 540732562 ecr 0,nop,wscale 7], length 0
2024-07-06 16:44:22.355235 IP 192.168.1.1.53 > 192.168.1.2.50495: 9424 1/0/0 A 142.250.187.195 (49)
2024-07-06 16:44:22.355241 IP 192.168.1.1.53 > 192.168.1.2.50495: 21967 1/0/0 AAAA 2a00:1450:4009:81e::2003 (61)
2024-07-06 16:44:22.355372 IP 192.168.1.2.45996 > 142.250.187.195.443: Flags [S], seq 2092982576, win 64240, options [mss 1460,sackOK,TS val 1573435397 ecr 0,nop,wscale 7], length 0
2024-07-06 16:44:22.363632 IP 142.250.187.195.443 > 192.168.1.2.45996: Flags [S.], seq 3339449649, ack 2092982577, win 65535, options [mss 1412,sackOK,TS val 2062930911 ecr 1573435397,nop,wscale 8], length 0
2024-07-06 16:44:22.363658 IP 192.168.1.2.45996 > 142.250.187.195.443: Flags [.], ack 1, win 502, options [nop,nop,TS val 1573435405 ecr 2062930911], length 0
2024-07-06 16:44:22.363669 IP 142.250.200.3.443 > 192.168.1.2.59856: Flags [S.], seq 520202760, ack 2193324290, win 65535, options [mss 1412,sackOK,TS val 1277364857 ecr 540732562,nop,wscale 8], length 0
2024-07-06 16:44:22.363675 IP 192.168.1.2.59856 > 142.250.200.3.443: Flags [.], ack 1, win 502, options [nop,nop,TS val 540732571 ecr 1277364857], length 0
2024-07-06 16:44:22.365214 IP 192.168.1.2.59856 > 142.250.200.3.443: Flags [P.], seq 1:518, ack 1, win 502, options [nop,nop,TS val 540732572 ecr 1277364857], length 517
2024-07-06 16:44:22.366607 IP 192.168.1.2.45996 > 142.250.187.195.443: Flags [P.], seq 1:518, ack 1, win 502, options [nop,nop,TS val 1573435408 ecr 2062930911], length 517
2024-07-06 16:44:22.373682 IP 142.250.200.3.443 > 192.168.1.2.59856: Flags [.], ack 518, win 261, options [nop,nop,TS val 1277364867 ecr 540732572], length 0
2024-07-06 16:44:22.375030 IP 142.250.187.195.443 > 192.168.1.2.45996: Flags [.], ack 518, win 261, options [nop,nop,TS val 2062930923 ecr 1573435408], length 0
2024-07-06 16:44:22.377608 IP 192.168.1.2.36162 > 142.250.178.4.443: UDP, length 569
2024-07-06 16:44:22.380016 IP 142.250.200.3.443 > 192.168.1.2.59856: Flags [P.], seq 1:4133, ack 518, win 261, options [nop,nop,TS val 1277364873 ecr 540732572], length 4132
2024-07-06 16:44:22.380032 IP 192.168.1.2.59856 > 142.250.200.3.443: Flags [.], ack 4133, win 489, options [nop,nop,TS val 540732587 ecr 1277364873], length 0
2024-07-06 16:44:22.381490 IP 142.250.187.195.443 > 192.168.1.2.45996: Flags [P.], seq 1:4132, ack 518, win 261, options [nop,nop,TS val 2062930929 ecr 1573435408], length 4131
2024-07-06 16:44:22.381500 IP 192.168.1.2.45996 > 142.250.187.195.443: Flags [.], ack 4132, win 489, options [nop,nop,TS val 1573435423 ecr 2062930929], length 0
2024-07-06 16:44:22.388697 IP 142.250.178.4.443 > 192.168.1.2.36162: UDP, length 34
2024-07-06 16:44:22.406615 IP 192.168.1.2.59856 > 142.250.200.3.443: Flags [P.], seq 518:582, ack 4133, win 501, options [nop,nop,TS val 540732613 ecr 1277364873], length 64
2024-07-06 16:44:22.406876 IP 192.168.1.2.45996 > 142.250.187.195.443: Flags [P.], seq 518:582, ack 4132, win 501, options [nop,nop,TS val 1573435449 ecr 2062930929], length 64
2024-07-06 16:44:22.407114 IP 192.168.1.2.59856 > 142.250.200.3.443: Flags [P.], seq 582:752, ack 4133, win 501, options [nop,nop,TS val 540732614 ecr 1277364873], length 170
2024-07-06 16:44:22.407140 IP 192.168.1.2.45996 > 142.250.187.195.443: Flags [P.], seq 582:752, ack 4132, win 501, options [nop,nop,TS val 1573435449 ecr 2062930929], length 170
2024-07-06 16:44:22.415513 IP 142.250.200.3.443 > 192.168.1.2.59856: Flags [P.], seq 4133:4747, ack 752, win 265, options [nop,nop,TS val 1277364909 ecr 540732613], length 614
2024-07-06 16:44:22.415540 IP 142.250.200.3.443 > 192.168.1.2.59856: Flags [P.], seq 4747:4778, ack 752, win 265, options [nop,nop,TS val 1277364909 ecr 540732613], length 31
2024-07-06 16:44:22.415573 IP 142.250.187.195.443 > 192.168.1.2.45996: Flags [P.], seq 4132:4746, ack 752, win 265, options [nop,nop,TS val 2062930963 ecr 1573435449], length 614
2024-07-06 16:44:22.415577 IP 142.250.187.195.443 > 192.168.1.2.45996: Flags [P.], seq 4746:4777, ack 752, win 265, options [nop,nop,TS val 2062930963 ecr 1573435449], length 31
2024-07-06 16:44:22.418904 IP 142.250.178.4.443 > 192.168.1.2.36162: UDP, length 27
2024-07-06 16:44:22.419737 IP 192.168.1.2.59856 > 142.250.200.3.443: Flags [P.], seq 752:783, ack 4778, win 501, options [nop,nop,TS val 540732627 ecr 1277364909], length 31
2024-07-06 16:44:22.420042 IP 192.168.1.2.45996 > 142.250.187.195.443: Flags [P.], seq 752:783, ack 4777, win 501, options [nop,nop,TS val 1573435462 ecr 2062930963], length 31
2024-07-06 16:44:22.420158 IP 192.168.1.2.36162 > 142.250.178.4.443: UDP, length 34
2024-07-06 16:44:22.425552 IP 142.250.178.4.443 > 192.168.1.2.36162: UDP, length 266
2024-07-06 16:44:22.426151 IP 192.168.1.2.36162 > 142.250.178.4.443: UDP, length 32
2024-07-06 16:44:22.432612 IP 142.250.200.3.443 > 192.168.1.2.59856: Flags [.], ack 783, win 265, options [nop,nop,TS val 1277364926 ecr 540732627], length 0
2024-07-06 16:44:22.432989 IP 142.250.187.195.443 > 192.168.1.2.45996: Flags [.], ack 783, win 265, options [nop,nop,TS val 2062930981 ecr 1573435462], length 0
2024-07-06 16:44:22.436352 IP 142.250.178.4.443 > 192.168.1.2.36162: UDP, length 29
2024-07-06 16:44:22.450484 IP 142.250.178.4.443 > 192.168.1.2.36162: UDP, length 1352
2024-07-06 16:44:22.450497 IP 142.250.178.4.443 > 192.168.1.2.36162: UDP, length 1357
2024-07-06 16:44:22.450506 IP 142.250.178.4.443 > 192.168.1.2.36162: UDP, length 1357
2024-07-06 16:44:22.450507 IP 142.250.178.4.443 > 192.168.1.2.36162: UDP, length 1357
2024-07-06 16:44:22.450556 IP 142.250.178.4.443 > 192.168.1.2.36162: UDP, length 1357
2024-07-06 16:44:22.450559 IP 142.250.178.4.443 > 192.168.1.2.36162: UDP, length 1357
2024-07-06 16:44:22.450560 IP 142.250.178.4.443 > 192.168.1.2.36162: UDP, length 1357
2024-07-06 16:44:22.450561 IP 142.250.178.4.443 > 192.168.1.2.36162: UDP, length 1357
2024-07-06 16:44:22.450703 IP 142.250.178.4.443 > 192.168.1.2.36162: UDP, length 1357
2024-07-06 16:44:22.450710 IP 142.250.178.4.443 > 192.168.1.2.36162: UDP, length 1357
2024-07-06 16:44:22.450712 IP 142.250.178.4.443 > 192.168.1.2.36162: UDP, length 1357
2024-07-06 16:44:22.450712 IP 142.250.178.4.443 > 192.168.1.2.36162: UDP, length 1167
2024-07-06 16:44:22.450714 IP 142.250.178.4.443 > 192.168.1.2.36162: UDP, length 1351
2024-07-06 16:44:22.450714 IP 142.250.178.4.443 > 192.168.1.2.36162: UDP, length 1357
2024-07-06 16:44:22.450765 IP 142.250.178.4.443 > 192.168.1.2.36162: UDP, length 1357
2024-07-06 16:44:22.451790 IP 192.168.1.2.36162 > 142.250.178.4.443: UDP, length 32
2024-07-06 16:44:22.451868 IP 142.250.178.4.443 > 192.168.1.2.36162: UDP, length 650
2024-07-06 16:44:22.453062 IP 192.168.1.2.36162 > 142.250.178.4.443: UDP, length 1011
2024-07-06 16:44:22.463987 IP 142.250.178.4.443 > 192.168.1.2.36162: UDP, length 34
2024-07-06 16:44:22.465032 IP 192.168.1.2.36162 > 142.250.178.4.443: UDP, length 32
2024-07-06 16:44:22.476027 IP 142.250.178.4.443 > 192.168.1.2.36162: UDP, length 213
2024-07-06 16:44:22.480927 IP 142.250.178.4.443 > 192.168.1.2.36162: UDP, length 26
2024-07-06 16:44:22.496941 IP 192.168.1.2.36162 > 142.250.178.4.443: UDP, length 38
2024-07-06 16:44:22.507790 IP 142.250.178.4.443 > 192.168.1.2.36162: UDP, length 29
2024-07-06 16:44:22.523386 IP 192.168.1.2.36162 > 142.250.178.4.443: UDP, length 528
2024-07-06 16:44:22.523555 IP 192.168.1.2.43588 > 142.250.178.3.80: Flags [.], ack 2319656866, win 501, options [nop,nop,TS val 821066995 ecr 3140942269], length 0
2024-07-06 16:44:22.531881 IP 142.250.178.3.80 > 192.168.1.2.43588: Flags [.], ack 1, win 261, options [nop,nop,TS val 3140952524 ecr 821036523], length 0
2024-07-06 16:44:22.533610 IP 142.250.178.4.443 > 192.168.1.2.36162: UDP, length 34
2024-07-06 16:44:22.536453 IP 192.168.1.2.59872 > 142.250.200.3.443: Flags [S], seq 4126230932, win 64240, options [mss 1460,sackOK,TS val 540732743 ecr 0,nop,wscale 7], length 0
2024-07-06 16:44:22.537340 IP 192.168.1.2.59876 > 142.250.200.3.443: Flags [S], seq 734701616, win 64240, options [mss 1460,sackOK,TS val 540732744 ecr 0,nop,wscale 7], length 0
2024-07-06 16:44:22.543793 IP 142.250.178.4.443 > 192.168.1.2.36162: UDP, length 1352
2024-07-06 16:44:22.543805 IP 142.250.178.4.443 > 192.168.1.2.36162: UDP, length 853
2024-07-06 16:44:22.543808 IP 142.250.178.4.443 > 192.168.1.2.36162: UDP, length 27
2024-07-06 16:44:22.544031 IP 192.168.1.2.36162 > 142.250.178.4.443: UDP, length 38
2024-07-06 16:44:22.544596 IP 142.250.200.3.443 > 192.168.1.2.59876: Flags [S.], seq 2793846960, ack 734701617, win 65535, options [mss 1412,sackOK,TS val 1507341445 ecr 540732744,nop,wscale 8], length 0
2024-07-06 16:44:22.544615 IP 192.168.1.2.59876 > 142.250.200.3.443: Flags [.], ack 1, win 502, options [nop,nop,TS val 540732751 ecr 1507341445], length 0
2024-07-06 16:44:22.544725 IP 142.250.200.3.443 > 192.168.1.2.59872: Flags [S.], seq 2817610074, ack 4126230933, win 65535, options [mss 1412,sackOK,TS val 2693817500 ecr 540732743,nop,wscale 8], length 0
2024-07-06 16:44:22.544733 IP 192.168.1.2.59872 > 142.250.200.3.443: Flags [.], ack 1, win 502, options [nop,nop,TS val 540732752 ecr 2693817500], length 0
2024-07-06 16:44:22.546087 IP 192.168.1.2.59876 > 142.250.200.3.443: Flags [P.], seq 1:518, ack 1, win 502, options [nop,nop,TS val 540732753 ecr 1507341445], length 517
2024-07-06 16:44:22.547447 IP 192.168.1.2.59872 > 142.250.200.3.443: Flags [P.], seq 1:518, ack 1, win 502, options [nop,nop,TS val 540732754 ecr 2693817500], length 517
2024-07-06 16:44:22.554172 IP 142.250.200.3.443 > 192.168.1.2.59876: Flags [.], ack 518, win 261, options [nop,nop,TS val 1507341455 ecr 540732753], length 0
2024-07-06 16:44:22.554940 IP 142.250.200.3.443 > 192.168.1.2.59872: Flags [.], ack 518, win 261, options [nop,nop,TS val 2693817511 ecr 540732754], length 0
2024-07-06 16:44:22.555566 IP 142.250.178.4.443 > 192.168.1.2.36162: UDP, length 29
2024-07-06 16:44:22.561605 IP 142.250.200.3.443 > 192.168.1.2.59872: Flags [P.], seq 1:4132, ack 518, win 261, options [nop,nop,TS val 2693817517 ecr 540732754], length 4131
2024-07-06 16:44:22.561624 IP 192.168.1.2.59872 > 142.250.200.3.443: Flags [.], ack 4132, win 489, options [nop,nop,TS val 540732768 ecr 2693817517], length 0
2024-07-06 16:44:22.562357 IP 142.250.200.3.443 > 192.168.1.2.59876: Flags [P.], seq 1:4131, ack 518, win 261, options [nop,nop,TS val 1507341463 ecr 540732753], length 4130
2024-07-06 16:44:22.562368 IP 192.168.1.2.59876 > 142.250.200.3.443: Flags [.], ack 4131, win 489, options [nop,nop,TS val 540732769 ecr 1507341463], length 0
2024-07-06 16:44:22.591372 IP 192.168.1.2.59872 > 142.250.200.3.443: Flags [P.], seq 518:582, ack 4132, win 501, options [nop,nop,TS val 540732798 ecr 2693817517], length 64
2024-07-06 16:44:22.594441 IP 192.168.1.2.59876 > 142.250.200.3.443: Flags [P.], seq 518:582, ack 4131, win 501, options [nop,nop,TS val 540732801 ecr 1507341463], length 64
2024-07-06 16:44:22.594619 IP 192.168.1.2.59872 > 142.250.200.3.443: Flags [P.], seq 582:752, ack 4132, win 501, options [nop,nop,TS val 540732801 ecr 2693817517], length 170
2024-07-06 16:44:22.594900 IP 192.168.1.2.59876 > 142.250.200.3.443: Flags [P.], seq 582:769, ack 4131, win 501, options [nop,nop,TS val 540732802 ecr 1507341463], length 187
2024-07-06 16:44:22.600039 IP 142.250.200.3.443 > 192.168.1.2.59872: Flags [P.], seq 4132:4746, ack 582, win 261, options [nop,nop,TS val 2693817556 ecr 540732798], length 614
2024-07-06 16:44:22.602782 IP 142.250.200.3.443 > 192.168.1.2.59876: Flags [P.], seq 4131:4745, ack 769, win 265, options [nop,nop,TS val 1507341503 ecr 540732801], length 614
2024-07-06 16:44:22.602800 IP 142.250.200.3.443 > 192.168.1.2.59876: Flags [P.], seq 4745:4776, ack 769, win 265, options [nop,nop,TS val 1507341503 ecr 540732801], length 31
2024-07-06 16:44:22.602887 IP 142.250.200.3.443 > 192.168.1.2.59872: Flags [P.], seq 4746:4777, ack 752, win 265, options [nop,nop,TS val 2693817559 ecr 540732801], length 31
2024-07-06 16:44:22.620100 IP 142.250.200.3.443 > 192.168.1.2.59876: Flags [P.], seq 4745:4776, ack 769, win 265, options [nop,nop,TS val 1507341521 ecr 540732801], length 31
2024-07-06 16:44:22.620119 IP 192.168.1.2.59876 > 142.250.200.3.443: Flags [.], ack 4776, win 499, options [nop,nop,TS val 540732827 ecr 1507341503,nop,nop,sack 1 {4745:4776}], length 0
2024-07-06 16:44:22.620833 IP 192.168.1.2.59872 > 142.250.200.3.443: Flags [P.], seq 752:783, ack 4777, win 501, options [nop,nop,TS val 540732828 ecr 2693817556], length 31
2024-07-06 16:44:22.621143 IP 192.168.1.2.59876 > 142.250.200.3.443: Flags [P.], seq 769:793, ack 4776, win 501, options [nop,nop,TS val 540732828 ecr 1507341503], length 24
2024-07-06 16:44:22.621160 IP 192.168.1.2.59876 > 142.250.200.3.443: Flags [F.], seq 793, ack 4776, win 501, options [nop,nop,TS val 540732828 ecr 1507341503], length 0
2024-07-06 16:44:22.622129 IP 142.250.200.3.443 > 192.168.1.2.59872: Flags [P.], seq 4746:4777, ack 752, win 265, options [nop,nop,TS val 2693817578 ecr 540732801], length 31
2024-07-06 16:44:22.622140 IP 192.168.1.2.59872 > 142.250.200.3.443: Flags [.], ack 4777, win 501, options [nop,nop,TS val 540732829 ecr 2693817578,nop,nop,sack 1 {4746:4777}], length 0
2024-07-06 16:44:22.628483 IP 142.250.200.3.443 > 192.168.1.2.59876: Flags [F.], seq 4776, ack 794, win 265, options [nop,nop,TS val 1507341529 ecr 540732828], length 0
2024-07-06 16:44:22.628509 IP 192.168.1.2.59876 > 142.250.200.3.443: Flags [.], ack 4777, win 501, options [nop,nop,TS val 540732835 ecr 1507341529], length 0
2024-07-06 16:44:22.633345 IP 142.250.200.3.443 > 192.168.1.2.59872: Flags [.], ack 783, win 265, options [nop,nop,TS val 2693817589 ecr 540732828], length 0
2024-07-06 16:44:22.679940 IP 142.250.178.4.443 > 192.168.1.2.36162: UDP, length 1349
2024-07-06 16:44:22.679955 IP 142.250.178.4.443 > 192.168.1.2.36162: UDP, length 1357
2024-07-06 16:44:22.679958 IP 142.250.178.4.443 > 192.168.1.2.36162: UDP, length 841
2024-07-06 16:44:22.680096 IP 192.168.1.2.36162 > 142.250.178.4.443: UDP, length 32
2024-07-06 16:44:22.683098 IP 142.250.178.4.443 > 192.168.1.2.36162: UDP, length 1349
2024-07-06 16:44:22.683113 IP 142.250.178.4.443 > 192.168.1.2.36162: UDP, length 1357
2024-07-06 16:44:22.683115 IP 142.250.178.4.443 > 192.168.1.2.36162: UDP, length 534
2024-07-06 16:44:22.684608 IP 192.168.1.2.36162 > 142.250.178.4.443: UDP, length 32
2024-07-06 16:44:22.689757 IP 142.250.178.4.443 > 192.168.1.2.36162: UDP, length 1349
2024-07-06 16:44:22.689772 IP 142.250.178.4.443 > 192.168.1.2.36162: UDP, length 1357
2024-07-06 16:44:22.689775 IP 142.250.178.4.443 > 192.168.1.2.36162: UDP, length 1357
2024-07-06 16:44:22.689776 IP 142.250.178.4.443 > 192.168.1.2.36162: UDP, length 1357
2024-07-06 16:44:22.689777 IP 142.250.178.4.443 > 192.168.1.2.36162: UDP, length 1357
2024-07-06 16:44:22.689779 IP 142.250.178.4.443 > 192.168.1.2.36162: UDP, length 1058
2024-07-06 16:44:22.689780 IP 142.250.178.4.443 > 192.168.1.2.36162: UDP, length 1349
2024-07-06 16:44:22.689781 IP 142.250.178.4.443 > 192.168.1.2.36162: UDP, length 1357
2024-07-06 16:44:22.689794 IP 142.250.178.4.443 > 192.168.1.2.36162: UDP, length 1357
2024-07-06 16:44:22.689795 IP 142.250.178.4.443 > 192.168.1.2.36162: UDP, length 1357
2024-07-06 16:44:22.689797 IP 142.250.178.4.443 > 192.168.1.2.36162: UDP, length 1357
2024-07-06 16:44:22.689798 IP 142.250.178.4.443 > 192.168.1.2.36162: UDP, length 1357
2024-07-06 16:44:22.689800 IP 142.250.178.4.443 > 192.168.1.2.36162: UDP, length 344
2024-07-06 16:44:22.693492 IP 192.168.1.2.36162 > 142.250.178.4.443: UDP, length 32
2024-07-06 16:44:22.693511 IP 142.250.178.4.443 > 192.168.1.2.36162: UDP, length 1349
2024-07-06 16:44:22.693518 IP 142.250.178.4.443 > 192.168.1.2.36162: UDP, length 1003
2024-07-06 16:44:22.693635 IP 192.168.1.2.36162 > 142.250.178.4.443: UDP, length 32
2024-07-06 16:44:22.693888 IP 142.250.178.4.443 > 192.168.1.2.36162: UDP, length 905
2024-07-06 16:44:22.697129 IP 142.250.178.4.443 > 192.168.1.2.36162: UDP, length 1349
2024-07-06 16:44:22.697143 IP 142.250.178.4.443 > 192.168.1.2.36162: UDP, length 1357
2024-07-06 16:44:22.697144 IP 142.250.178.4.443 > 192.168.1.2.36162: UDP, length 1357
2024-07-06 16:44:22.697145 IP 142.250.178.4.443 > 192.168.1.2.36162: UDP, length 381
2024-07-06 16:44:22.697315 IP 142.250.178.4.443 > 192.168.1.2.36162: UDP, length 50
2024-07-06 16:44:22.697908 IP 192.168.1.2.36162 > 142.250.178.4.443: UDP, length 32
2024-07-06 16:44:22.701152 IP 142.250.178.4.443 > 192.168.1.2.36162: UDP, length 1349
2024-07-06 16:44:22.701165 IP 142.250.178.4.443 > 192.168.1.2.36162: UDP, length 1357
2024-07-06 16:44:22.701168 IP 142.250.178.4.443 > 192.168.1.2.36162: UDP, length 235
2024-07-06 16:44:22.701886 IP 142.250.178.4.443 > 192.168.1.2.36162: UDP, length 1349
2024-07-06 16:44:22.701890 IP 142.250.178.4.443 > 192.168.1.2.36162: UDP, length 1357
2024-07-06 16:44:22.701891 IP 142.250.178.4.443 > 192.168.1.2.36162: UDP, length 1357
2024-07-06 16:44:22.701892 IP 142.250.178.4.443 > 192.168.1.2.36162: UDP, length 1357
2024-07-06 16:44:22.701984 IP 142.250.178.4.443 > 192.168.1.2.36162: UDP, length 1357
2024-07-06 16:44:22.701987 IP 142.250.178.4.443 > 192.168.1.2.36162: UDP, length 1357
2024-07-06 16:44:22.701988 IP 142.250.178.4.443 > 192.168.1.2.36162: UDP, length 1357
2024-07-06 16:44:22.701989 IP 142.250.178.4.443 > 192.168.1.2.36162: UDP, length 402
2024-07-06 16:44:22.709159 IP 192.168.1.2.36162 > 142.250.178.4.443: UDP, length 33
2024-07-06 16:44:22.712421 IP 142.250.178.4.443 > 192.168.1.2.36162: UDP, length 1349
2024-07-06 16:44:22.712434 IP 142.250.178.4.443 > 192.168.1.2.36162: UDP, length 1357
2024-07-06 16:44:22.712436 IP 142.250.178.4.443 > 192.168.1.2.36162: UDP, length 1357
2024-07-06 16:44:22.712437 IP 142.250.178.4.443 > 192.168.1.2.36162: UDP, length 861
2024-07-06 16:44:22.712560 IP 192.168.1.2.36162 > 142.250.178.4.443: UDP, length 33
2024-07-06 16:44:22.772351 IP 142.250.178.4.443 > 192.168.1.2.36162: UDP, length 1349
2024-07-06 16:44:22.772365 IP 142.250.178.4.443 > 192.168.1.2.36162: UDP, length 1357
2024-07-06 16:44:22.772367 IP 142.250.178.4.443 > 192.168.1.2.36162: UDP, length 1357
2024-07-06 16:44:22.772368 IP 142.250.178.4.443 > 192.168.1.2.36162: UDP, length 1357
2024-07-06 16:44:22.772369 IP 142.250.178.4.443 > 192.168.1.2.36162: UDP, length 1357
2024-07-06 16:44:22.772370 IP 142.250.178.4.443 > 192.168.1.2.36162: UDP, length 1357
2024-07-06 16:44:22.772461 IP 142.250.178.4.443 > 192.168.1.2.36162: UDP, length 1357
2024-07-06 16:44:22.772464 IP 142.250.178.4.443 > 192.168.1.2.36162: UDP, length 1357
2024-07-06 16:44:22.772465 IP 142.250.178.4.443 > 192.168.1.2.36162: UDP, length 1357
2024-07-06 16:44:22.772466 IP 142.250.178.4.443 > 192.168.1.2.36162: UDP, length 1357
2024-07-06 16:44:22.772467 IP 142.250.178.4.443 > 192.168.1.2.36162: UDP, length 1357
2024-07-06 16:44:22.772603 IP 142.250.178.4.443 > 192.168.1.2.36162: UDP, length 1357
2024-07-06 16:44:22.772607 IP 142.250.178.4.443 > 192.168.1.2.36162: UDP, length 42
2024-07-06 16:44:22.772609 IP 142.250.178.4.443 > 192.168.1.2.36162: UDP, length 1349
2024-07-06 16:44:22.772610 IP 142.250.178.4.443 > 192.168.1.2.36162: UDP, length 1357
2024-07-06 16:44:22.772611 IP 142.250.178.4.443 > 192.168.1.2.36162: UDP, length 1357
2024-07-06 16:44:22.772612 IP 142.250.178.4.443 > 192.168.1.2.36162: UDP, length 1357
2024-07-06 16:44:22.772766 IP 142.250.178.4.443 > 192.168.1.2.36162: UDP, length 1357
2024-07-06 16:44:22.772768 IP 142.250.178.4.443 > 192.168.1.2.36162: UDP, length 1357
2024-07-06 16:44:22.772769 IP 142.250.178.4.443 > 192.168.1.2.36162: UDP, length 1357
2024-07-06 16:44:22.772912 IP 142.250.178.4.443 > 192.168.1.2.36162: UDP, length 1357
2024-07-06 16:44:22.772914 IP 142.250.178.4.443 > 192.168.1.2.36162: UDP, length 1357
2024-07-06 16:44:22.772915 IP 142.250.178.4.443 > 192.168.1.2.36162: UDP, length 1357
2024-07-06 16:44:22.772916 IP 142.250.178.4.443 > 192.168.1.2.36162: UDP, length 1357
2024-07-06 16:44:22.772917 IP 142.250.178.4.443 > 192.168.1.2.36162: UDP, length 1357
2024-07-06 16:44:22.772918 IP 142.250.178.4.443 > 192.168.1.2.36162: UDP, length 490
2024-07-06 16:44:22.773358 IP 142.250.178.4.443 > 192.168.1.2.36162: UDP, length 1349
2024-07-06 16:44:22.773361 IP 142.250.178.4.443 > 192.168.1.2.36162: UDP, length 1357
2024-07-06 16:44:22.773362 IP 142.250.178.4.443 > 192.168.1.2.36162: UDP, length 1357
2024-07-06 16:44:22.773363 IP 142.250.178.4.443 > 192.168.1.2.36162: UDP, length 1357
2024-07-06 16:44:22.773501 IP 142.250.178.4.443 > 192.168.1.2.36162: UDP, length 1357
2024-07-06 16:44:22.773503 IP 142.250.178.4.443 > 192.168.1.2.36162: UDP, length 1357
2024-07-06 16:44:22.773504 IP 142.250.178.4.443 > 192.168.1.2.36162: UDP, length 1357
2024-07-06 16:44:22.773505 IP 142.250.178.4.443 > 192.168.1.2.36162: UDP, length 1357
2024-07-06 16:44:22.773506 IP 142.250.178.4.443 > 192.168.1.2.36162: UDP, length 1180
2024-07-06 16:44:22.779710 IP 192.168.1.2.36162 > 142.250.178.4.443: UDP, length 33
2024-07-06 16:44:22.791437 IP 142.250.178.4.443 > 192.168.1.2.36162: UDP, length 193
2024-07-06 16:44:22.796375 IP 142.250.178.4.443 > 192.168.1.2.36162: UDP, length 253
2024-07-06 16:44:22.804431 IP 192.168.1.2.36162 > 142.250.178.4.443: UDP, length 33
2024-07-06 16:44:22.908774 IP 192.168.1.2.36162 > 142.250.178.4.443: UDP, length 811
2024-07-06 16:44:22.910516 IP 192.168.1.2.47999 > 142.250.180.3.443: UDP, length 706
2024-07-06 16:44:22.912737 IP 192.168.1.2.36162 > 142.250.178.4.443: UDP, length 710
2024-07-06 16:44:22.918837 IP 142.250.178.4.443 > 192.168.1.2.36162: UDP, length 1202
2024-07-06 16:44:22.919093 IP 192.168.1.2.36162 > 142.250.178.4.443: UDP, length 33
2024-07-06 16:44:22.923526 IP 142.250.178.4.443 > 192.168.1.2.36162: UDP, length 34
2024-07-06 16:44:22.923669 IP 192.168.1.2.36162 > 142.250.178.4.443: UDP, length 33
2024-07-06 16:44:22.929139 IP 142.250.178.4.443 > 192.168.1.2.36162: UDP, length 29
2024-07-06 16:44:22.929151 IP 142.250.180.3.443 > 192.168.1.2.47999: UDP, length 585
2024-07-06 16:44:22.929268 IP 142.250.180.3.443 > 192.168.1.2.47999: UDP, length 24
2024-07-06 16:44:22.929501 IP 192.168.1.2.47999 > 142.250.180.3.443: UDP, length 36
2024-07-06 16:44:22.933596 IP 142.250.178.4.443 > 192.168.1.2.36162: UDP, length 213
2024-07-06 16:44:22.933649 IP 142.250.178.4.443 > 192.168.1.2.36162: UDP, length 26
2024-07-06 16:44:22.934895 IP 192.168.1.2.36162 > 142.250.178.4.443: UDP, length 40
2024-07-06 16:44:22.945144 IP 142.250.178.4.443 > 192.168.1.2.36162: UDP, length 29
2024-07-06 16:44:22.963378 IP 142.250.180.3.443 > 192.168.1.2.47999: UDP, length 27
2024-07-06 16:44:23.028002 IP 192.168.1.2.47556 > 213.123.255.78.80: Flags [.], ack 1575921732, win 501, options [nop,nop,TS val 3833778165 ecr 1099926374], length 0
2024-07-06 16:44:23.035173 IP 213.123.255.78.80 > 192.168.1.2.47556: Flags [.], ack 1, win 501, options [nop,nop,TS val 1099936621 ecr 3833747504], length 0
2024-07-06 16:44:23.094784 IP 192.168.1.2.36162 > 142.250.178.4.443: UDP, length 1357
2024-07-06 16:44:23.094822 IP 192.168.1.2.36162 > 142.250.178.4.443: UDP, length 1339
2024-07-06 16:44:23.106091 IP 142.250.178.4.443 > 192.168.1.2.36162: UDP, length 34
2024-07-06 16:44:23.116720 IP 142.250.178.4.443 > 192.168.1.2.36162: UDP, length 1352
2024-07-06 16:44:23.116866 IP 142.250.178.4.443 > 192.168.1.2.36162: UDP, length 1357
2024-07-06 16:44:23.116871 IP 142.250.178.4.443 > 192.168.1.2.36162: UDP, length 1357
2024-07-06 16:44:23.116872 IP 142.250.178.4.443 > 192.168.1.2.36162: UDP, length 1357
2024-07-06 16:44:23.116873 IP 142.250.178.4.443 > 192.168.1.2.36162: UDP, length 1357
2024-07-06 16:44:23.117062 IP 142.250.178.4.443 > 192.168.1.2.36162: UDP, length 1357
2024-07-06 16:44:23.117066 IP 142.250.178.4.443 > 192.168.1.2.36162: UDP, length 1357
2024-07-06 16:44:23.117067 IP 142.250.178.4.443 > 192.168.1.2.36162: UDP, length 1357
2024-07-06 16:44:23.117068 IP 142.250.178.4.443 > 192.168.1.2.36162: UDP, length 1357
2024-07-06 16:44:23.117068 IP 142.250.178.4.443 > 192.168.1.2.36162: UDP, length 1357
2024-07-06 16:44:23.117069 IP 142.250.178.4.443 > 192.168.1.2.36162: UDP, length 1357
2024-07-06 16:44:23.117070 IP 142.250.178.4.443 > 192.168.1.2.36162: UDP, length 276
2024-07-06 16:44:23.117223 IP 142.250.178.4.443 > 192.168.1.2.36162: UDP, length 1351
2024-07-06 16:44:23.117226 IP 142.250.178.4.443 > 192.168.1.2.36162: UDP, length 1357
2024-07-06 16:44:23.117227 IP 142.250.178.4.443 > 192.168.1.2.36162: UDP, length 1357
2024-07-06 16:44:23.117228 IP 142.250.178.4.443 > 192.168.1.2.36162: UDP, length 1357
2024-07-06 16:44:23.117284 IP 142.250.178.4.443 > 192.168.1.2.36162: UDP, length 1357
2024-07-06 16:44:23.117286 IP 142.250.178.4.443 > 192.168.1.2.36162: UDP, length 1357
2024-07-06 16:44:23.117287 IP 142.250.178.4.443 > 192.168.1.2.36162: UDP, length 1357
2024-07-06 16:44:23.117288 IP 142.250.178.4.443 > 192.168.1.2.36162: UDP, length 1357
2024-07-06 16:44:23.117289 IP 142.250.178.4.443 > 192.168.1.2.36162: UDP, length 1357
2024-07-06 16:44:23.117290 IP 142.250.178.4.443 > 192.168.1.2.36162: UDP, length 1357
2024-07-06 16:44:23.117374 IP 142.250.178.4.443 > 192.168.1.2.36162: UDP, length 1357
2024-07-06 16:44:23.117377 IP 142.250.178.4.443 > 192.168.1.2.36162: UDP, length 1357
2024-07-06 16:44:23.117378 IP 142.250.178.4.443 > 192.168.1.2.36162: UDP, length 484
2024-07-06 16:44:23.117790 IP 142.250.178.4.443 > 192.168.1.2.36162: UDP, length 1349
2024-07-06 16:44:23.117793 IP 142.250.178.4.443 > 192.168.1.2.36162: UDP, length 1357
2024-07-06 16:44:23.117795 IP 142.250.178.4.443 > 192.168.1.2.36162: UDP, length 1357
2024-07-06 16:44:23.117796 IP 142.250.178.4.443 > 192.168.1.2.36162: UDP, length 1357
2024-07-06 16:44:23.117969 IP 142.250.178.4.443 > 192.168.1.2.36162: UDP, length 1357
2024-07-06 16:44:23.117973 IP 142.250.178.4.443 > 192.168.1.2.36162: UDP, length 1357
2024-07-06 16:44:23.117974 IP 142.250.178.4.443 > 192.168.1.2.36162: UDP, length 1357
2024-07-06 16:44:23.117975 IP 142.250.178.4.443 > 192.168.1.2.36162: UDP, length 1357
2024-07-06 16:44:23.118294 IP 192.168.1.2.36162 > 142.250.178.4.443: UDP, length 40
2024-07-06 16:44:23.118354 IP 142.250.178.4.443 > 192.168.1.2.36162: UDP, length 1357
2024-07-06 16:44:23.118357 IP 142.250.178.4.443 > 192.168.1.2.36162: UDP, length 1357
2024-07-06 16:44:23.118358 IP 142.250.178.4.443 > 192.168.1.2.36162: UDP, length 1357
2024-07-06 16:44:23.118359 IP 142.250.178.4.443 > 192.168.1.2.36162: UDP, length 1357
2024-07-06 16:44:23.118360 IP 142.250.178.4.443 > 192.168.1.2.36162: UDP, length 490
2024-07-06 16:44:23.118440 IP 192.168.1.2.36162 > 142.250.178.4.443: UDP, length 33
2024-07-06 16:44:23.126375 IP 142.250.178.4.443 > 192.168.1.2.36162: UDP, length 1349
2024-07-06 16:44:23.126388 IP 142.250.178.4.443 > 192.168.1.2.36162: UDP, length 1357
2024-07-06 16:44:23.126391 IP 142.250.178.4.443 > 192.168.1.2.36162: UDP, length 1357
2024-07-06 16:44:23.126392 IP 142.250.178.4.443 > 192.168.1.2.36162: UDP, length 1357
2024-07-06 16:44:23.126393 IP 142.250.178.4.443 > 192.168.1.2.36162: UDP, length 1357
2024-07-06 16:44:23.126472 IP 142.250.178.4.443 > 192.168.1.2.36162: UDP, length 1357
2024-07-06 16:44:23.126481 IP 142.250.178.4.443 > 192.168.1.2.36162: UDP, length 1357
2024-07-06 16:44:23.126482 IP 142.250.178.4.443 > 192.168.1.2.36162: UDP, length 1357
2024-07-06 16:44:23.126483 IP 142.250.178.4.443 > 192.168.1.2.36162: UDP, length 1357
2024-07-06 16:44:23.126484 IP 142.250.178.4.443 > 192.168.1.2.36162: UDP, length 1357
2024-07-06 16:44:23.126519 IP 142.250.178.4.443 > 192.168.1.2.36162: UDP, length 1357
2024-07-06 16:44:23.126521 IP 142.250.178.4.443 > 192.168.1.2.36162: UDP, length 1357
2024-07-06 16:44:23.126522 IP 142.250.178.4.443 > 192.168.1.2.36162: UDP, length 476
2024-07-06 16:44:23.126687 IP 142.250.178.4.443 > 192.168.1.2.36162: UDP, length 1349
2024-07-06 16:44:23.126690 IP 142.250.178.4.443 > 192.168.1.2.36162: UDP, length 1357
2024-07-06 16:44:23.126691 IP 142.250.178.4.443 > 192.168.1.2.36162: UDP, length 1357
2024-07-06 16:44:23.126692 IP 142.250.178.4.443 > 192.168.1.2.36162: UDP, length 1357
2024-07-06 16:44:23.126717 IP 192.168.1.2.36162 > 142.250.178.4.443: UDP, length 33
2024-07-06 16:44:23.126839 IP 142.250.178.4.443 > 192.168.1.2.36162: UDP, length 1357
2024-07-06 16:44:23.126842 IP 142.250.178.4.443 > 192.168.1.2.36162: UDP, length 1357
2024-07-06 16:44:23.126851 IP 142.250.178.4.443 > 192.168.1.2.36162: UDP, length 1357
2024-07-06 16:44:23.126852 IP 142.250.178.4.443 > 192.168.1.2.36162: UDP, length 1357
2024-07-06 16:44:23.126900 IP 142.250.178.4.443 > 192.168.1.2.36162: UDP, length 1357
2024-07-06 16:44:23.126903 IP 142.250.178.4.443 > 192.168.1.2.36162: UDP, length 1357
2024-07-06 16:44:23.126904 IP 142.250.178.4.443 > 192.168.1.2.36162: UDP, length 1357
2024-07-06 16:44:23.126905 IP 142.250.178.4.443 > 192.168.1.2.36162: UDP, length 1357
2024-07-06 16:44:23.126905 IP 142.250.178.4.443 > 192.168.1.2.36162: UDP, length 490
2024-07-06 16:44:23.126982 IP 192.168.1.2.36162 > 142.250.178.4.443: UDP, length 33
2024-07-06 16:44:23.128521 IP 142.250.178.4.443 > 192.168.1.2.36162: UDP, length 29
2024-07-06 16:44:23.135516 IP 142.250.178.4.443 > 192.168.1.2.36162: UDP, length 1349
2024-07-06 16:44:23.135530 IP 142.250.178.4.443 > 192.168.1.2.36162: UDP, length 1357
2024-07-06 16:44:23.135533 IP 142.250.178.4.443 > 192.168.1.2.36162: UDP, length 1357
2024-07-06 16:44:23.135534 IP 142.250.178.4.443 > 192.168.1.2.36162: UDP, length 1357
2024-07-06 16:44:23.135612 IP 142.250.178.4.443 > 192.168.1.2.36162: UDP, length 1357
2024-07-06 16:44:23.135620 IP 142.250.178.4.443 > 192.168.1.2.36162: UDP, length 1357
2024-07-06 16:44:23.135621 IP 142.250.178.4.443 > 192.168.1.2.36162: UDP, length 1357
2024-07-06 16:44:23.135622 IP 142.250.178.4.443 > 192.168.1.2.36162: UDP, length 1357
2024-07-06 16:44:23.135623 IP 142.250.178.4.443 > 192.168.1.2.36162: UDP, length 1357
2024-07-06 16:44:23.135677 IP 142.250.178.4.443 > 192.168.1.2.36162: UDP, length 1357
2024-07-06 16:44:23.135680 IP 142.250.178.4.443 > 192.168.1.2.36162: UDP, length 1357
2024-07-06 16:44:23.135681 IP 142.250.178.4.443 > 192.168.1.2.36162: UDP, length 1357
2024-07-06 16:44:23.135682 IP 142.250.178.4.443 > 192.168.1.2.36162: UDP, length 490
2024-07-06 16:44:23.136259 IP 142.250.178.4.443 > 192.168.1.2.36162: UDP, length 1349
2024-07-06 16:44:23.136264 IP 142.250.178.4.443 > 192.168.1.2.36162: UDP, length 1357
2024-07-06 16:44:23.136265 IP 142.250.178.4.443 > 192.168.1.2.36162: UDP, length 1357
2024-07-06 16:44:23.136266 IP 142.250.178.4.443 > 192.168.1.2.36162: UDP, length 1357
2024-07-06 16:44:23.136461 IP 142.250.178.4.443 > 192.168.1.2.36162: UDP, length 1357
2024-07-06 16:44:23.136464 IP 142.250.178.4.443 > 192.168.1.2.36162: UDP, length 1357
2024-07-06 16:44:23.136465 IP 142.250.178.4.443 > 192.168.1.2.36162: UDP, length 1357
2024-07-06 16:44:23.136466 IP 142.250.178.4.443 > 192.168.1.2.36162: UDP, length 1357
2024-07-06 16:44:23.136467 IP 142.250.178.4.443 > 192.168.1.2.36162: UDP, length 1357
2024-07-06 16:44:23.136468 IP 142.250.178.4.443 > 192.168.1.2.36162: UDP, length 1357
2024-07-06 16:44:23.136469 IP 142.250.178.4.443 > 192.168.1.2.36162: UDP, length 1357
2024-07-06 16:44:23.136470 IP 142.250.178.4.443 > 192.168.1.2.36162: UDP, length 1357
2024-07-06 16:44:23.136474 IP 142.250.178.4.443 > 192.168.1.2.36162: UDP, length 490
2024-07-06 16:44:23.136913 IP 142.250.178.4.443 > 192.168.1.2.36162: UDP, length 1349
2024-07-06 16:44:23.136918 IP 142.250.178.4.443 > 192.168.1.2.36162: UDP, length 1357
2024-07-06 16:44:23.136919 IP 142.250.178.4.443 > 192.168.1.2.36162: UDP, length 1357
2024-07-06 16:44:23.136920 IP 142.250.178.4.443 > 192.168.1.2.36162: UDP, length 1357
2024-07-06 16:44:23.136991 IP 142.250.178.4.443 > 192.168.1.2.36162: UDP, length 1357
2024-07-06 16:44:23.136994 IP 142.250.178.4.443 > 192.168.1.2.36162: UDP, length 1357
2024-07-06 16:44:23.136995 IP 142.250.178.4.443 > 192.168.1.2.36162: UDP, length 1357
2024-07-06 16:44:23.137109 IP 142.250.178.4.443 > 192.168.1.2.36162: UDP, length 1357
2024-07-06 16:44:23.137113 IP 142.250.178.4.443 > 192.168.1.2.36162: UDP, length 1357
2024-07-06 16:44:23.137114 IP 142.250.178.4.443 > 192.168.1.2.36162: UDP, length 1357
2024-07-06 16:44:23.137115 IP 142.250.178.4.443 > 192.168.1.2.36162: UDP, length 1357
2024-07-06 16:44:23.137204 IP 142.250.178.4.443 > 192.168.1.2.36162: UDP, length 1357
2024-07-06 16:44:23.137207 IP 142.250.178.4.443 > 192.168.1.2.36162: UDP, length 490
2024-07-06 16:44:23.141162 IP 142.250.178.4.443 > 192.168.1.2.36162: UDP, length 1349
2024-07-06 16:44:23.141181 IP 142.250.178.4.443 > 192.168.1.2.36162: UDP, length 1357
2024-07-06 16:44:23.141183 IP 142.250.178.4.443 > 192.168.1.2.36162: UDP, length 1357
2024-07-06 16:44:23.141185 IP 142.250.178.4.443 > 192.168.1.2.36162: UDP, length 1357
2024-07-06 16:44:23.141187 IP 142.250.178.4.443 > 192.168.1.2.36162: UDP, length 1357
2024-07-06 16:44:23.141188 IP 142.250.178.4.443 > 192.168.1.2.36162: UDP, length 1357
2024-07-06 16:44:23.141189 IP 142.250.178.4.443 > 192.168.1.2.36162: UDP, length 1357
2024-07-06 16:44:23.141191 IP 142.250.178.4.443 > 192.168.1.2.36162: UDP, length 1357
2024-07-06 16:44:23.141200 IP 142.250.178.4.443 > 192.168.1.2.36162: UDP, length 1357
2024-07-06 16:44:23.141202 IP 142.250.178.4.443 > 192.168.1.2.36162: UDP, length 1357
2024-07-06 16:44:23.141203 IP 142.250.178.4.443 > 192.168.1.2.36162: UDP, length 1357
2024-07-06 16:44:23.141204 IP 142.250.178.4.443 > 192.168.1.2.36162: UDP, length 1357
2024-07-06 16:44:23.141205 IP 142.250.178.4.443 > 192.168.1.2.36162: UDP, length 490
2024-07-06 16:44:23.141207 IP 142.250.178.4.443 > 192.168.1.2.36162: UDP, length 1349
2024-07-06 16:44:23.141208 IP 142.250.178.4.443 > 192.168.1.2.36162: UDP, length 1357
2024-07-06 16:44:23.141209 IP 142.250.178.4.443 > 192.168.1.2.36162: UDP, length 1357
2024-07-06 16:44:23.141225 IP 142.250.178.4.443 > 192.168.1.2.36162: UDP, length 1357
2024-07-06 16:44:23.141227 IP 142.250.178.4.443 > 192.168.1.2.36162: UDP, length 1357
2024-07-06 16:44:23.141229 IP 142.250.178.4.443 > 192.168.1.2.36162: UDP, length 1357
2024-07-06 16:44:23.141229 IP 142.250.178.4.443 > 192.168.1.2.36162: UDP, length 1357
2024-07-06 16:44:23.141230 IP 142.250.178.4.443 > 192.168.1.2.36162: UDP, length 1357
2024-07-06 16:44:23.141231 IP 142.250.178.4.443 > 192.168.1.2.36162: UDP, length 1357
2024-07-06 16:44:23.141232 IP 142.250.178.4.443 > 192.168.1.2.36162: UDP, length 1357
2024-07-06 16:44:23.141233 IP 142.250.178.4.443 > 192.168.1.2.36162: UDP, length 1357
2024-07-06 16:44:23.141239 IP 142.250.178.4.443 > 192.168.1.2.36162: UDP, length 1357
2024-07-06 16:44:23.141240 IP 142.250.178.4.443 > 192.168.1.2.36162: UDP, length 490
2024-07-06 16:44:23.141241 IP 142.250.178.4.443 > 192.168.1.2.36162: UDP, length 1349
2024-07-06 16:44:23.141242 IP 142.250.178.4.443 > 192.168.1.2.36162: UDP, length 1357
2024-07-06 16:44:23.141243 IP 142.250.178.4.443 > 192.168.1.2.36162: UDP, length 1357
2024-07-06 16:44:23.141244 IP 142.250.178.4.443 > 192.168.1.2.36162: UDP, length 1357
2024-07-06 16:44:23.141245 IP 142.250.178.4.443 > 192.168.1.2.36162: UDP, length 1357
2024-07-06 16:44:23.141246 IP 142.250.178.4.443 > 192.168.1.2.36162: UDP, length 1357
2024-07-06 16:44:23.141259 IP 142.250.178.4.443 > 192.168.1.2.36162: UDP, length 1357
2024-07-06 16:44:23.141260 IP 142.250.178.4.443 > 192.168.1.2.36162: UDP, length 1357
2024-07-06 16:44:23.141262 IP 142.250.178.4.443 > 192.168.1.2.36162: UDP, length 1357
2024-07-06 16:44:23.141263 IP 142.250.178.4.443 > 192.168.1.2.36162: UDP, length 1357
2024-07-06 16:44:23.141264 IP 142.250.178.4.443 > 192.168.1.2.36162: UDP, length 1357
2024-07-06 16:44:23.141265 IP 142.250.178.4.443 > 192.168.1.2.36162: UDP, length 1357
2024-07-06 16:44:23.141266 IP 142.250.178.4.443 > 192.168.1.2.36162: UDP, length 490
2024-07-06 16:44:23.141267 IP 142.250.178.4.443 > 192.168.1.2.36162: UDP, length 1349
